,id,name,category
582,buy_907,sony dpfd70 digital photo frame,Camera_and_Photo
584,buy_548,toshiba d-r560 dvd player/recorder,Other_Electronics
587,buy_67,canon ef-s 17-85mm f/4 -5.6 is usm standard zoom lens,Camera_and_Photo
590,buy_590,toshiba 22lv505 22 ' widescreen lcd hdtv w / built-in dvd player 1000:1 contrast ratio 5ms response time black,Other_Electronics
593,buy_513,toshiba sd-4100 dvd player,Other_Electronics
599,buy_414,sony lcs-twa/r cyber-shot camera case,Camera_and_Photo
601,buy_430,lacie little disk hard drive 301278,Computers_and_Accessories
611,buy_291,transcend 2gb microsd card ts2gusd,Computers_and_Accessories
631,buy_992,canon powershot sd880 is digital camera silver 3197b001,Camera_and_Photo
637,buy_575,sharp aquos lc-52se94u 52 ' lcd tv,Other_Electronics
639,buy_356,universal remote control mrf-350 addressable narrow band rf base station with rfx-250 antenna,Other_Electronics
645,buy_505,canon vixia hv30 high definition digital camcorder 2680b001,Camera_and_Photo
653,buy_587,sony alpha dslr-a350 digital slr camera dslra350,Camera_and_Photo
655,buy_98,canon cli-8pm photo magenta ink cartridge 0625b002,Camera_and_Photo
658,buy_687,sharp lc26dv24u 26 ' tv/dvd combo,Other_Electronics
668,buy_734,samsung htx810t home theater system htx810t,Other_Electronics
683,buy_509,canon fs10 digital camcorder 2686b001,Camera_and_Photo
691,buy_172,linksys wireless-n wrvs4400n gigabit security router with vpn,Computers_and_Accessories
694,buy_265,sony 1gb memory stick micro ( m2 ) card msa1gd,Computers_and_Accessories
702,buy_459,sony lcs-csl cyber-shot camera case,Camera_and_Photo
705,buy_939,canon cl-211 color ink cartridge for pixma mp240 and mp480 printers 2976b001,Office_Products
711,buy_595,panasonic dvd-ls86 portable dvd player,Other_Electronics
720,buy_980,canon dc310 digital camcorder 2694b001,Camera_and_Photo
731,buy_573,sony cyber-shot dsc-w120 digital camera pink dscw120/p,Camera_and_Photo
746,buy_641,panasonic kx-tg9348t expandable digital cordless phone,Other_Electronics
748,buy_0,linksys etherfast ezxs88w ethernet switch ezxs88w,Computers_and_Accessories
751,buy_475,nikon d300 digital slr camera 25432,Camera_and_Photo
759,buy_825,speck products seethru case for apple 15 ' macbook pro mb15-grn-see-v2,Computers_and_Accessories
764,buy_762,sony dvp-fx820 / l portable dvd player dvpfx820/l,Other_Electronics
766,buy_1003,apple ipod classic 120gb hard drive portable media player mb562ll/a,Other_Electronics
767,buy_577,sony handycam dcr-sr45 digital camcorder dcrsr45,Camera_and_Photo
773,buy_287,peerless sglb01 flat panel tv stand,Other_Electronics
775,buy_297,sanus flat panel ceiling mount sc1a-b1,Other_Electronics
778,buy_39,omnimount universal wall speaker mounting kit 20.0 wall-b,Tools_and_Home_Improvement
781,buy_325,weber genesis s-320 3780001 60 ' freestanding gas grill,Home_and_Garden
786,buy_549,toshiba d-vr660 dvd/vcr combo,Other_Electronics
799,buy_658,samsung ln46a550 46 ' lcd tv,Other_Electronics
805,buy_789,lg 5.0 cu.ft . freestanding gas range,Home_and_Garden
808,buy_561,panasonic viera th-50pz80u 50 ' plasma tv,Other_Electronics
818,buy_968,canon pixma ip4600 inkjet color photo printer 2909b002,Other_Electronics
819,buy_48,sanus wall/ceiling speaker mount wms3s silver,Other_Electronics
826,buy_443,sony infolithium d-type np-fd1 digital camera battery npfd1,Camera_and_Photo
836,buy_827,speck products seethru case for apple 15 ' macbook pro mb15-pur-see-v2,Computers_and_Accessories
837,buy_722,sony str-dg720 a/v receiver strdg720,Other_Electronics
844,buy_692,samsung htz410t home theater system htz410t,Other_Electronics
856,buy_132,"lowepro rezo 15 camera case microfiber , ripstop nylon black ( black )",Camera_and_Photo
861,buy_547,toshiba d-vr610 dvd vcr combo,Other_Electronics
871,buy_83,canon cli-8m ink cartridge 0622b002,Camera_and_Photo
882,buy_52,sanus flat panel tv wall mount vmpl50-b,Tools_and_Home_Improvement
886,buy_1001,applecare for ipod touch or ipod classic mb591ll/a,Other_Electronics
890,buy_215,lg electronics 24 ' washer/dryer combo : white,Home_and_Garden
896,buy_949,sony bravia dav-is50 / b home theater system,Other_Electronics
899,buy_255,canon bci-6 color ink cartridges 4705a018,Camera_and_Photo
908,buy_457,garmin suction cup mount 010-10815-00,Automotive
926,buy_813,linksys wrt610n simultaneous dual-n band wireless router,Computers_and_Accessories
935,buy_604,yamaha ns-aw190 all-weather speaker system ns-aw190bl,Other_Electronics
937,buy_675,samsung 4 series ln32a450 32 ' lcd tv,Other_Electronics
939,buy_609,nikon d60 digital slr camera with af-s dx nikkor 18-55mm f/3 .5 -5.6 g vr lens 25438,Camera_and_Photo
940,buy_640,panasonic kx-tg9332t cordless phone,Other_Electronics
944,buy_592,toshiba 19lv505 19 ' widescreen lcd hdtv w / built-in dvd player 800:1 contrast ratio 5ms response time,Other_Electronics
945,buy_157,peerless plav70-unlp-s articulating dual-arm with vertical adjustment plav70 unlps,Other_Electronics
952,buy_9,linksys etherfast ef4124 ethernet switch,Computers_and_Accessories
960,buy_826,speck products seethru case for apple 15 ' macbook pro mb15-org-see-v2,Computers_and_Accessories
974,buy_796,denon dht-fs3 2-piece home theater audio system,Other_Electronics
977,buy_1081,simpletech 2gb sd card 3505b001aa,Computers_and_Accessories
990,buy_1039,sharp aquos bd-hp21u blu-ray disc player,Other_Electronics
991,buy_583,canon bp-808 lithium ion camcorder battery pack 2740b002,Camera_and_Photo
996,buy_557,panasonic viera th-42pz85u 42 ' plasma tv,Other_Electronics
1012,buy_179,panasonic kx-tsc14w 2-line telephone,Office_Products
1021,buy_588,sony alpha dslr-a350k digital slr camera with 18-70mm zoom lens black dslra350k,Camera_and_Photo
1026,buy_481,logitech harmony rf extender 915-000044,Other_Electronics
1032,buy_294,nikon en-el9 lithium ion digital camera battery pack 25353,Camera_and_Photo
1033,buy_210,sony dvpcx995v dvd player,Other_Electronics
1062,buy_6,canon kp 36ip print cartridge paper kit 7737a001,Camera_and_Photo
1079,buy_1091,case mate carbon fiber iphone 3g case black iph3gc-bcf,Cell_Phones_and_Accessories
1080,buy_885,sony bravia xbr series kdl-37xbr6 37 ' lcd tv kdl37xbr6,Other_Electronics
1081,buy_888,sony str-dg820 a/v receiver strdg820,Other_Electronics
1096,buy_858,sony z570n/b notebook vgnz570n/b,Computers_and_Accessories
1103,buy_110,linksys wireless-g wrt54gl broadband router,Computers_and_Accessories
1105,buy_480,linksys rangeplus wrt160n 4-port wireless-n broadband router wrt160n,Computers_and_Accessories
1115,buy_56,panasonic kx-tca92 headset,Cell_Phones_and_Accessories
1118,buy_780,lg 1.6 cu.ft . over the range microwave,Home_and_Garden
1125,buy_621,sony 16gb memory stick pro duo card ( mark 2 ) msmt16g,'Other_Electronics'
1137,buy_424,lg xl capacity electric dryer,Home_and_Garden
1145,buy_521,weber q 320 gas grill,Home_and_Garden
1148,buy_946,garmin nvi 755t automobile navigator 010-00715-30,Automotive
1149,buy_125,sony vaio sz series docking station vgpprsz1,Computers_and_Accessories
1162,buy_593,toshiba sd-p101s portable dvd player sdp101s,Other_Electronics
1164,buy_891,sony bravia m series kdl-32m4000 32 ' lcd tv kdl32m4000,Other_Electronics
1169,buy_870,whirlpool du1055xtss 6 ' console undercounter dishwasher ( stainless steel ),Home_and_Garden
1171,buy_1030,sony vaio cs180j/q notebook vgncs180j/q,Computers_and_Accessories
1179,buy_671,sony 4gb memory stick pro duo card msmt4g,Camera_and_Photo
1195,buy_810,canon selphy cp760 dye sublimation printer 2565b001,Camera_and_Photo
1209,buy_115,linksys wireless-g wusb54gc compact usb adapter,Computers_and_Accessories
1215,buy_197,sony cdp-cx455 cd player/changer cdpcx455,Other_Electronics
1224,buy_578,sony handycam dcr-sr85 digital camcorder dcrsr85,Camera_and_Photo
1226,buy_1022,sony dpfd80 digital photo frame,Camera_and_Photo
1232,buy_400,logitech v470 cordless laser mouse for notebooks 910-000298,Computers_and_Accessories
1233,buy_694,samsung 6 series ln19a650 19 ' lcd tv,Other_Electronics
1251,buy_487,lacie usb 2.0 external hard drive 301302u,Computers_and_Accessories
1256,buy_512,sharp aquos lc37d44u 37 ' lcd tv lc37d44u,Other_Electronics
1258,buy_506,canon vixia hf100 high definition digital camcorder 2708b001,Camera_and_Photo
1263,buy_344,panasonic nnsd667s 1.2 cu . ft. countertop microwave oven in stainless steel,Home_and_Garden
1271,buy_700,techcraft abs60 tv stand,Home_and_Garden
1276,buy_914,"samsung ht-bd2t blu-ray 7.1 home theater system blu-ray , dvd & cd playback , fm receiver w/30 station presets , 1100w total output , 4 tower speakers & subwoofer ht-bd2t / xaa",Other_Electronics
1287,buy_242,sirius suph1 sirius universal home kit,Other_Electronics
1291,buy_461,panasonic kx-tg8232b cordless phone,Other_Electronics
1310,buy_14,belkin monitor cable f3h982-25,Computers_and_Accessories
1312,buy_974,canon pixma mp980 wireless all-in-one color photo inkjet printer 2922b002,Office_Products
1319,buy_158,sanus visionmount flat panel tv wall mount mf110-b1,Tools_and_Home_Improvement
1321,buy_550,toshiba sd-6100 dvd player,Other_Electronics
1326,buy_721,sony str-dg520 a/v receiver strdg520,Other_Electronics
1329,buy_141,panasonic kx-tga670b cordless handset,Other_Electronics
1338,buy_1017,"canon eos 50d 15 megapixel slr digital camera with live view & face detection , 3 ' lcd , 6.3 fps & digic 4 image processor body only 2807b006",Camera_and_Photo
1346,buy_120,sanus vcd/dvd wall mount vmavb,Other_Electronics
1348,buy_1037,apple macbook notebook mb467lla,Computers_and_Accessories
1354,buy_873,whirlpool wtw6700tu cabrio 4.6 cu . ft. top load washer ( diamond dust ),Home_and_Garden
1367,buy_572,denon dvd-2500btci blu-ray disc player,Other_Electronics
1377,buy_245,nikon en-el3e lithium ion digital camera battery 25334,Camera_and_Photo
1383,buy_884,mitsubishi wd-60735 60 ' projection tv,Other_Electronics
1389,buy_316,frigidaire electric dryer feq1442wh 5.8 cubic foot super capacity drum,Home_and_Garden
1408,buy_73,sanus under cabinet lcd tv mount vmuc1s,Tools_and_Home_Improvement
1409,buy_418,canon eos 40d digital slr camera 1901b004,Camera_and_Photo
1410,buy_258,olympus li-42b lithium ion digital camera battery 202034,Camera_and_Photo
1412,buy_539,garmin adjustable vehicle suction cup 010-10823-03,Automotive
1421,buy_162,canon psc-55 deluxe leather camera case 1588b001,Camera_and_Photo
1426,buy_864,sony ht-ct100 home theater system,Other_Electronics
1428,buy_877,weber genesis ep-320 blue lp gas grill,Home_and_Garden
1441,buy_1086,canon xh a1s 3238b001,Camera_and_Photo
1469,buy_131,sony compact tripod 14 ' / 39 ' * nic * vctr100,Camera_and_Photo
1470,buy_1015,apple ipod touch 8gb flash portable media player mb528lla,Other_Electronics
1473,buy_1048,sony icd-b600 512mb digital voice recorder icdb600,Other_Electronics
1477,buy_483,motorola motorokr t505 bluetooth in-car speakerphone 89149,Automotive
1502,buy_803,pure digital flip mino digital camcorder f360b,Camera_and_Photo
1512,buy_644,olympus evolt e-420 digital slr camera with 14 42mm f/3 .5 - f/5 .6 zuiko digital zoom lens black 262081,Camera_and_Photo
1528,buy_876,weber summit sp-320 stainless lp gas grill,Home_and_Garden
1544,buy_944,"garmin nuvi 265wt 4.3 ' widescreen gps w/text to speech , bluetooth , where am i ? , connect photos 010-00575-10",Automotive
1547,buy_363,canon speedlite 580ex ii flash light 1946b002,Camera_and_Photo
1559,buy_503,lacie little disk hard drive 301829,Computers_and_Accessories
1561,buy_42,peerless adjustable tv wall mount pm1327,Tools_and_Home_Improvement
1567,buy_194,sony scd-ce595 cd player scdce595,Other_Electronics
1580,buy_229,belkin cushtop f8n044-org,Computers_and_Accessories
1583,buy_691,samsung 6 series hl61a650 61 ' projection tv,Other_Electronics
1587,buy_288,transcend 8gb jetflash v10 usb flash drive ts8gjfv10,Computers_and_Accessories
1613,buy_108,panasonic nn-h965bf microwave oven counter top 2.2 ft 1250w black,Home_and_Garden
1635,buy_218,lg electronics lrbp1031w 10 cu . ft. refrigerator,Home_and_Garden
1699,buy_614,peerless pp730 universal pivot wall arm,Tools_and_Home_Improvement
1713,buy_812,maytag 2.0 cu . ft. over-the-range microwave oven,Home_and_Garden
1721,buy_1032,"sony vaio cs series vgn-cs180j / r 14.1-inch notebook 2.26 ghz intel core 2 duo p8400 processor , 4 gb ram , 320 gb hard drive , blu-ray drive , vista home premium - red vgncs180j/r",Computers_and_Accessories
1722,buy_44,panasonic kx-tca86 headset,'Cell_Phones_and_Accessories'
1723,buy_354,frigidaire 27 '' electric stack washer dryer combo fex831wh extra-large capacity wash tub,Home_and_Garden
1731,buy_746,"samsung pn50a650 50 ' 1080p plasma hdtv 1,000,000:1 dynamic contrast ratio anti burn-in technology",Other_Electronics
1737,buy_148,pioneer nautica marine remote control,Other_Electronics
1742,buy_96,logitech cordless desktop mx 5000 laser 967562-0403,Computers_and_Accessories
1754,buy_875,weber summit e-620 copper lp gas grill,Home_and_Garden
1767,buy_690,samsung 6 series hl56a650 56 ' projection tv,Other_Electronics
1785,buy_364,altec lansing inmotion im600 portable audio speaker system im600,Other_Electronics
1792,buy_564,sony rdrvxd655 dvd/vcr combo,Other_Electronics
1806,buy_674,"handycam hdr-ux10 dvd camcorder ( 15x opt , 180x dig , 2.7 ' lcd ) hdrux10",Camera_and_Photo
1833,buy_411,peerless smartmount 700 series articulating wall arm,Tools_and_Home_Improvement
1843,buy_310,sanus mf215-b1 extending full motion mount,Tools_and_Home_Improvement
1857,buy_323,audiovox ve927 9 ' tv/dvd combo,Other_Electronics
1865,buy_710,sony pslx300usb usb record turntable,Other_Electronics
1866,buy_617,sony vct-60av tripod vct60av,Camera_and_Photo
1867,buy_787,lg 5.0 cu.ft . freestanding gas range,Home_and_Garden
1876,buy_60,canon nb-2lh battery pack 9612a001,Camera_and_Photo
1878,buy_1038,vholdr wearable camcorder ( black ) 1102,Camera_and_Photo
1889,buy_788,lg 5.0 cu.ft . freestanding gas range,Home_and_Garden
1892,buy_146,uniden tcx905 cordless handset tcx905,Other_Electronics
1899,buy_612,panasonic viera tc-37lz85 37 ' lcd tv,Other_Electronics
1905,buy_1044,escort passport 9500ix radar/laser detector,Automotive
1916,buy_786,lg 5.6 cu.ft . freestanding electric range,Home_and_Garden
1940,buy_890,sony bravia z series kdl-46z4100 46 ' lcd tv kdl46z4100/b,Other_Electronics
1946,buy_130,canon psc-75 deluxe soft case 0716b001,Camera_and_Photo
1949,buy_684,yamaha rx-v863 home theater receiver rxv863bl,Other_Electronics
1954,buy_121,sony memory stick usb card reader/writer msacus40,Computers_and_Accessories
1971,buy_1049,canon psc-4000 deluxe leather case n 3528b001,Camera_and_Photo
1984,buy_628,"sony mylo com-2 pda ( 1gb , memory stick duo ) personal communicator com2white",Other_Electronics
1989,buy_790,canon psc-85 soft camera case 2595b002,Camera_and_Photo
1994,buy_1005,apple 8gb ipod nano blue ( 4th generation ) mb732ll/a,Other_Electronics
1996,buy_729,omnimount moda collection echo 50 tv stand echo 50,Home_and_Garden
2008,buy_444,sony lcj-thc/b jacket case with stylus lcj-thc/w,Camera_and_Photo
2014,buy_367,logitech v220 cordless optical mouse for notebooks 910-000153,Computers_and_Accessories
2019,buy_832,sony rdr-vx560 dvd/vcr combo,Other_Electronics
2029,buy_1028,aliph jawbone 2 silver bluetooth headset retail 84442vrp,Cell_Phones_and_Accessories
2031,buy_373,kenwood ipod direct cable kcaip200,Other_Electronics
2052,buy_872,whirlpool wtw6700tw 28 ' cabrio series top loader washer ( metallic/white ),Home_and_Garden
2058,buy_109,panasonic nn-h965wf luxury full-size 2-1/5 - cubic-foot 1250-watt microwave oven - white,Home_and_Garden
2059,buy_555,plantronics . audio 920 wireless earset 78592-01,'Cell_Phones_and_Accessories'
2083,buy_802,logitech quickcam vision pro webcam 960-000254,Computers_and_Accessories
2086,buy_243,logitech harmony 1000 advanced universal remote control 966230-0403,Other_Electronics
2090,buy_144,weber q 300 gas grill,Home_and_Garden
2108,buy_1026,"th-58pz850u 58 ' plasma tv ( widescreen , 1920x1080 , 30,000:1 , hdtv ) th58pz850u",Other_Electronics
2115,buy_317,frigidaire electric dryer feq332wh 5.7 cu.ft . super capacity drum,Home_and_Garden
2117,buy_286,sony playstation 3 blu-ray dvd remote 98046,Video_Games
2137,buy_1051,sony bravia vpl-hw10 digital projector vplhw10,Other_Electronics
2155,buy_455,the lg electric steamdryer,Home_and_Garden
2159,buy_175,panasonic bl-c1a network camera,Camera_and_Photo
2166,buy_1078,audiovox dpf701 7-inch acrylic digital picture frame,Camera_and_Photo
2179,buy_711,yamaha rx-v363 home theater receiver rxv363bl,Other_Electronics
2199,buy_570,sony hesv1000 blu-ray player/recorder,Other_Electronics
2227,buy_647,samsung ln40a550 40 ' lcd tv,Other_Electronics
2240,buy_445,sony lcs-csj soft camera case lcscsj,Camera_and_Photo
2244,buy_350,sony slvd380p dvd/vcr combo,Other_Electronics
2255,buy_282,monster cable gamelink hdmi digital video/audio cable for playstation 3 1 x hdmi 6.56 ft ps3 hdmi-2m,Video_Games
2265,buy_473,polkaudio csi a6 black high performance center channel loudspeaker am6615-a,Other_Electronics
2287,buy_851,griffin protective wave case for smart phone 8227-ip2wvb,Cell_Phones_and_Accessories
2315,buy_95,logitech dinovo media desktop laser 967562-0403,Computers_and_Accessories
2324,buy_386,audiovox xpress r xm radio receiver with vehicle kit xmck20p,Automotive
2330,buy_63,omnimount tv top shelf mount,Other_Electronics
2344,buy_698,"samsung pn42a450 42 ' widescreen 720p plasma hdtv 100,000:1 dynamic contrast ratio piano black pn42a450p",Other_Electronics
2356,buy_268,panasonic kx-fp145 plain paper thermal transfer fax/copier kxfp145,Office_Products
2363,buy_745,nintendo ds lite ( metallic rose ) usgszpb,Video_Games
2370,buy_38,belkin pro series usb device cable 16 f3u133-16,Computers_and_Accessories
2379,buy_995,apple ipod shuffle 1gb flash mp3 player mb811ll/a,Other_Electronics
2385,buy_973,canon pixma mp620 wireless photo all-in-one inkjet printer 2921b002,Office_Products
2405,buy_993,"canon powershot sd990 is 14 megapixel digital camera w / 3.7 x optical zoom , ua len , face detection , 2.5 lcd , & iso 1600 black 2669b001",Camera_and_Photo
2406,buy_697,samsung ln32a550 32 ' lcd tv,Other_Electronics
2418,buy_91,netgear prosafe fs116p ethernet switch fs116pna,Computers_and_Accessories
2419,buy_815,speck products seethru case for apple 15 ' macbook pro mb15-clr-see-v2,Computers_and_Accessories
2433,buy_304,canon e-p100 photo pack for selphy es1 printer 1335b001,Camera_and_Photo
2434,buy_352,pioneer cd-r55 wireless remote for avic-d3 / 4900dvd cdr55,Other_Electronics
2445,buy_966,nikon d90 digital slr camera with af-s dx nikkor 18-105mm f/3 .5 -5.6 g ed vr lens 25448,Camera_and_Photo
2482,buy_947,garmin auto nav 010-00715-20,Automotive
2509,buy_331,sony stereo bluetooth headset * nic * tmrbt10/tmrbt10a,Other_Electronics
2521,buy_903,denon avr-1609 a/v receiver avr1609,Other_Electronics
2522,buy_391,logitech cordless desktop wave 920-000264,Computers_and_Accessories
2526,buy_358,nikon 55-200mm f/4 -5.6 g ed if af-s dx vr zoom telephoto nikkor lens niko_216687518,Camera_and_Photo
2556,buy_77,weber 841001 performer 22.5 ' charcoal grill in black,Home_and_Garden
2578,buy_666,samsung ln40a650 40 ' lcd tv,Other_Electronics
2624,buy_808,samsung yp-s2zw 1gb flash mp3 player yp-s2zg / xaa,Other_Electronics
2676,buy_990,sony vaio ns190j/s notebook vgnns190j/s,Computers_and_Accessories
2687,buy_150,pioneer ts-p462 speaker,Automotive
2692,buy_165,garmin usb cable 010-10723-01,Computers_and_Accessories
2723,buy_117,sony ribbon and paper with snap-off edges for dpp-fp50 digital photo printer svmf120p,Camera_and_Photo
2731,buy_773,lg 25 cf refrigerator 3 door white tall,Home_and_Garden
2736,buy_40,omnimount stainless steel speaker mount 20.0 wall-w,Tools_and_Home_Improvement
2760,buy_440,klipsch groove pm20 computer speakers 1007596,Computers_and_Accessories
2773,buy_563,panasonic viera th-42px80u 42 ' plasma tv,Other_Electronics
2817,buy_5,lacie pocket floppy disk drive 706018,Computers_and_Accessories
2819,buy_566,panasonic lithium ion camcorder battery vw-vbg130,Camera_and_Photo
2831,buy_2,netgear prosafe fs105 ethernet switch fs105na,Computers_and_Accessories
2850,buy_190,audiovox cnp2000h xm mini-tuner home dock,Other_Electronics
2855,buy_195,sony cdp-ce375 cd player/changer cdpce375,Other_Electronics
2869,buy_427,tivo tiv652160 tivo high definition,Other_Electronics
2896,buy_854,yamaha ysp-3050 digital sound projector ysp-3050bl,Other_Electronics
2901,buy_683,"panasonic viera th-50pz800u 50 ' widescreen 1080p plasma hdtv 1,000,000:1 dynamic contrast ratio",Other_Electronics
2919,buy_984,ge gsd4000nww dishwasher with 5 wash cycles std tub estar ( white ) gsd4000nww,Home_and_Garden
2951,buy_18,sony vaio notebook and ac adapter case vgpamc2,Computers_and_Accessories
2958,buy_482,sirius scvdoc1 siriusconnect ? universal vehicle kit,Automotive
2960,buy_1041,sharp lc-52d85u 52 ' widescreen 1080p lcd hdtv 120hz 4ms response time,Other_Electronics
2976,buy_353,whirlpool duet sport 27 '' electric dryer wed8300swh 6.7 cubic foot capacity,Home_and_Garden
2989,buy_209,garmin vehicle suction mount 010-10609-00,Automotive
3018,buy_856,nintendo ds lite ( metallic silver ),Video_Games
3039,buy_29,playstation 2 dualshock analog controller green,Video_Games
3042,buy_981,sony icf-s79w weather band digital shower radio icfs79w,Other_Electronics
3043,buy_13,netgear prosafe gs105 ethernet switch gs105na,Computers_and_Accessories
3058,buy_1043,sharp aquos lc-42d85u 42 ' lcd tv,Other_Electronics
3110,buy_355,nikon 18-200mm 3.5-5 .6 g ed dx afs vr zoom wide angle nikkor lens niko_215930348,Camera_and_Photo
3114,buy_174,panasonic bb-hcm331a outdoor network camera with 2-way audio,Camera_and_Photo
3125,buy_163,garmin ga 25mcx low profile remote gps antenna 010-10702-00,Other_Electronics
3150,buy_514,uniden dcx300 dect 6.0 accessory handset and cradle for the dect2000 series,Other_Electronics
3174,buy_208,denon dp-300f analog record turntable dp300f,CDs_and_Vinyl
3177,buy_807,samsung yp-s2zw 1gb flash mp3 player yp-s2zw / xaa,Other_Electronics
3183,buy_198,cordless solo s2 radar/laser detector 010es20a,Automotive
3187,buy_49,sony mini dvd-r media 3dmr30l1h,Other_Electronics
3216,buy_293,omnimount wishbone large/x-large premium cantilever mount and universal adapter ucl-xb,Tools_and_Home_Improvement
3245,buy_45,sony vct-r640 tripod vctr640,Camera_and_Photo
3272,buy_394,sharp 1100 watt over the counter microwave,Home_and_Garden
3290,buy_600,toshiba 19av500u 19 ' lcd tv,Other_Electronics
3345,buy_306,omnimount cmk-mini mini wall mounted cable management system,Tools_and_Home_Improvement
3349,buy_385,audiovox xmck5p expressez satellite radio xmck5p,Other_Electronics
3425,buy_501,griffin itrip autopilot fm transmitter 4046-trpautoc,Automotive
3449,buy_466,sirius sl2pk1 sirius stiletto 2 portable radio,Other_Electronics
3468,buy_804,pure digital flip mino digital camcorder f360w,Camera_and_Photo
3497,buy_707,ex series earbuds wht mdr ex32lp/whi,Other_Electronics
3500,buy_837,onkyo txsr606 a/v receiver,Other_Electronics
3540,buy_319,genesis series 3741001 60 ' freestanding gas grill with 637 sq. in . cooking surface & 3 stainless steel burners : black lp gas,
3553,buy_315,panasonic sr-na18 10-cup rice cooker/warmer with advanced fuzzy logic technology,
3570,buy_1057,denon dvd-1800bd blu-ray disc player,
3576,buy_259,canon cb-2lx battery charger 1133b001,
3588,buy_431,apple ipod shuffle 1gb mp3 player mb226ll/a,
3595,buy_1059,canon rebel xsi/xs starter kit 9320a009,
3607,buy_177,panasonic kx-ts3282w corded telephone,
3618,buy_170,sharp r-1214 microwave oven r-1214,
3634,buy_740,pioneer dehp400ub car audio player,
3660,buy_591,toshiba 19lv506 19 ' widescreen lcd hdtv w / built-in dvd player 800:1 contrast ratio 5ms response time white,
3706,buy_860,frigidarie gld4355rf 24 ' gallery speed clean dishwasher ( black ),
3715,buy_901,mitsubishi diamond wd-65835 65 ' projection tv,
3721,buy_450,transcend 8gb compact flash card ( 133x ) ts8gcf133,
3722,buy_733,samsung sc-d382 digital camcorder,
3739,buy_1011,apple ipod nano 16gb flash portable media player mb913ll/a,
3752,buy_853,3g iphone black toughskin iph3g-blk-ts,
3804,buy_779,lg semi-integrated electronic panel with digital status display dishwasher,
3912,buy_651,samsung pn50a450 50 ' plasma tv,
3964,buy_809,onkyo cs-325 stereo cd receiver mini audio system,
3967,buy_985,ge gsd2400nww dishwasher with 5 wash cycles gsd2400nww,
4040,buy_219,lg navy blue steamwasher 27 ',
4050,buy_942,"tx-sr806b receiver ( 7.1 channels , 130 w/channel , 0.08 % thd , supports 8 devices ) txsr806b",
4070,buy_135,ge millennium tv antenna 24734,
4108,buy_1066,apple 8x dvdrw drive mb397g/a,
4137,buy_462,panasonic pt-ax200u home theater projector,
4154,buy_247,sony lcs-csh soft camera case lcscsh,
4174,buy_730,onkyo txsr506 a/v receiver,
4212,buy_1027,motorola t305 bluetooth visor speaker phone car kit retail 89082j,
4230,buy_1013,usb power adapter accs mb352ll/b,
4252,buy_111,audiovox xm6 outdoor home antenna xm-6,
4273,buy_137,uniden tcx905 tru-digital expansion handset with caller id,
4301,buy_679,tomtom one 130 carry bag 9uea .017.00,
4311,buy_976,sony vaio lv all-in-one desktop vgclv150j,
4354,buy_718,griffin smarttalk headphone adapter with control and mic for iphone 3016-smrtlkb,
4377,buy_935,"nikon coolpix s60 10 megapixel digital camera w / 5x optical zoom , optical vr image stabilization , 3.5 ' high res touch panel lcd , hd pictmotion slide shows , & autofocus and auto exposure pink 26132",
4385,buy_703,ex series earbuds black mdr ex32lp/blk,
4469,buy_324,garmin portable friction mount,
4601,buy_28,sony 7-11719-70670-0 ps2 8 mb memory card 2-pk 97067,
4639,buy_235,olympus neoprene soft camera case 202066,
4654,buy_75,sanus universal projector ceiling mount vmpr1b,
4696,buy_785,lg 5.6 cu.ft . freestanding electric range,
4736,buy_53,sony ps-lx350h belt-drive turntable,
4739,buy_957,samsung 4gb portable mltimdia plyr blk yps-s3jab / xaa,
4748,buy_925,toshiba sd-v296 dvd/vcr combo,
